{
  "opendb_id": "e226656d-74f6-43f6-addb-af20f5bc36ff",
  "metadata": {
    "name": "Seagate FireCuda 520 Rev 2.0 1TB SSD M.2-2280 PCIe 4.0 X4 NVMe",
    "manufacturer": "Seagate",
    "part_numbers": [
      "ZP1000GV3A012"
    ],
    "series": "FireCuda",
    "variant": "1000GB"
  },
  "capacity": 1000,
  "type": "SSD",
  "form_factor": "M.2-2280",
  "interface": "M.2 PCIe 4.0 X4",
  "nvme": true,
  "general_product_information": {}
}