{
  "opendb_id": "7bf784a5-7496-4f81-8688-3635379a49aa",
  "metadata": {
    "name": "Mushkin Pilot-E 500GB SSD M.2-2280 NVMe",
    "manufacturer": "Mushkin",
    "part_numbers": [
      "MKNSSDPE500GB-D8"
    ],
    "series": "Pilot-E",
    "variant": "500GB"
  },
  "capacity": 500,
  "type": "SSD",
  "form_factor": "M.2-2280",
  "interface": "M.2 PCIe 3.0 X4",
  "nvme": true,
  "general_product_information": {}
}