{
  "opendb_id": "dd1d5777-5e9a-4d8e-b9f4-f28285bd5c8a",
  "metadata": {
    "name": "Western Digital Red Plus 8TB 3.5\" HDD 5640RPM SATA 6.0 Gb/s",
    "manufacturer": "Western Digital",
    "part_numbers": [
      "WD80EFZZ"
    ],
    "series": "Red",
    "variant": "8000GB"
  },
  "capacity": 8000,
  "type": "5640 RPM",
  "form_factor": "3.5\"",
  "interface": "SATA 6.0 Gb/s",
  "nvme": false,
  "general_product_information": {
    "amazon_sku": "B09QQX27GM",
    "newegg_sku": "9SIAD6HGZN3256",
    "bestbuy_sku": 6523110,
    "walmart_sku": 836328689
  }
}