{
  "opendb_id": "0c9c6e4e-2a32-4e2d-849a-2fe55ec42c8a",
  "metadata": {
    "name": "Netac NV3000 250 GB SSD M.2-2280 PCIe 3.0 x4 NVMe",
    "manufacturer": "Netac",
    "part_numbers": [
      "NT01NV3000-250-E4X"
    ],
    "series": "NV3000",
    "variant": "250GB"
  },
  "capacity": 250,
  "type": "SSD",
  "form_factor": "M.2-2280",
  "interface": "M.2 PCIe 3.0 X4",
  "nvme": true,
  "general_product_information": {}
}