{
  "opendb_id": "658c79c0-224e-4931-b3fc-d98b6ab7c251",
  "metadata": {
    "name": "Samsung Spinpoint F3 1TB Internal HDD 7200RPM 3.5\" SATA 3.0 Gb/s",
    "manufacturer": "Samsung",
    "part_numbers": [
      "HD103SJ"
    ],
    "series": "Spinpoint",
    "variant": "1000GB"
  },
  "capacity": 1000,
  "type": "7200 RPM",
  "form_factor": "3.5\"",
  "interface": "SATA 3.0 Gb/s",
  "nvme": false,
  "general_product_information": {
    "amazon_sku": "B002NXPARA"
  }
}