{
  "opendb_id": "200b98ee-7d92-48ec-a1bd-1b952f94020b",
  "metadata": {
    "name": "Seagate BarraCuda 500GB 3.5\" HDD 7200RPM SATA",
    "manufacturer": "Seagate",
    "part_numbers": [
      "ST3500320AS"
    ],
    "series": "BarraCuda",
    "variant": "500GB"
  },
  "capacity": 500,
  "type": "7200 RPM",
  "form_factor": "3.5\"",
  "interface": "SATA 3.0 Gb/s",
  "nvme": false,
  "general_product_information": {}
}