{
  "opendb_id": "9899ea60-8265-4d3a-99f7-e4667361ef05",
  "metadata": {
    "name": "Seagate IronWolf Pro NAS 4TB HDD 3.5\" 7200RPM SATA",
    "manufacturer": "Seagate",
    "part_numbers": [
      "ST4000NT001"
    ],
    "series": "IronWolf",
    "variant": "4000GB"
  },
  "capacity": 4000,
  "type": "7200 RPM",
  "form_factor": "3.5\"",
  "interface": "SATA 6.0 Gb/s",
  "nvme": false,
  "general_product_information": {
    "amazon_sku": "B0B94MX35D",
    "newegg_sku": "N82E16822185079",
    "walmart_sku": 1710439437
  }
}