{
  "opendb_id": "4ef34900-c043-42e6-8c11-28b8493a771c",
  "metadata": {
    "name": "Seagate IronWolf Pro 4TB HDD 3.5\" 7200RPM SATA 6.0 Gb/s",
    "manufacturer": "Seagate",
    "part_numbers": [
      "ST4000NE001"
    ],
    "series": "IronWolf",
    "variant": "4000GB"
  },
  "capacity": 4000,
  "type": "7200 RPM",
  "form_factor": "3.5\"",
  "interface": "SATA 6.0 Gb/s",
  "nvme": false,
  "general_product_information": {
    "amazon_sku": "B07SY4T6F5",
    "newegg_sku": "N82E16822184797",
    "walmart_sku": 443913713
  }
}