{
  "opendb_id": "620d620d-8221-4828-9f6e-713e58f365ec",
  "metadata": {
    "name": "Samsung 840 120GB SSD 2.5\" SATA",
    "manufacturer": "Samsung",
    "part_numbers": [
      "MZ-7TD120KW"
    ],
    "series": "840",
    "variant": "120GB"
  },
  "capacity": 120,
  "type": "SSD",
  "form_factor": "2.5\"",
  "interface": "SATA 6.0 Gb/s",
  "nvme": false,
  "general_product_information": {}
}