{
  "opendb_id": "fed28fce-dc6e-4725-9b3b-6efbdd4fe826",
  "metadata": {
    "name": "Kingston A2000 1TB SSD M.2-2280 PCIe 3.0 X4 NVMe",
    "manufacturer": "Kingston",
    "part_numbers": [
      "SA2000M8",
      "1000G"
    ],
    "series": "A2000",
    "variant": "1000GB"
  },
  "capacity": 1000,
  "type": "SSD",
  "form_factor": "M.2-2280",
  "interface": "M.2 PCIe 3.0 X4",
  "nvme": true,
  "general_product_information": {
    "amazon_sku": "B07VXC9QMH",
    "newegg_sku": "9SIA22FKCT1714",
    "walmart_sku": 785106647
  }
}