{
  "opendb_id": "8e45272c-d4c6-4e87-bd11-d2452b2d24b7",
  "metadata": {
    "name": "Western Digital Purple 8TB 3.5\" HDD 7200RPM SATA",
    "manufacturer": "Western Digital",
    "part_numbers": [
      "WD82PURZ"
    ],
    "series": "Purple",
    "variant": "8000GB"
  },
  "capacity": 8000,
  "type": "7200 RPM",
  "form_factor": "3.5\"",
  "interface": "SATA 6.0 Gb/s",
  "nvme": false,
  "general_product_information": {
    "amazon_sku": "B07RRCQVN1",
    "walmart_sku": 915258149
  }
}