{
  "opendb_id": "303b4349-4ffb-4030-9dfb-03f9a69b00ea",
  "metadata": {
    "name": "Lexar NM610 500GB M.2-2280 SSD PCIe 3.0 x4 NVMe",
    "manufacturer": "Lexar",
    "part_numbers": [
      "LNM610-500RBNA                                                    LNM610-500RB"
    ],
    "series": "NM610",
    "variant": "500GB"
  },
  "capacity": 500,
  "type": "SSD",
  "form_factor": "M.2-2280",
  "interface": "M.2 PCIe 3.0 X4",
  "nvme": true,
  "general_product_information": {
    "amazon_sku": "B07WL653V8",
    "walmart_sku": 350332505
  }
}