{
  "opendb_id": "5b034752-4036-4b04-af25-0471b70b57fe",
  "metadata": {
    "name": "Oyen Digital Dash Pro 4TB SSD M.2 PCIe 4.0 NVMe w/Heat Sink",
    "manufacturer": "Oyen Digital",
    "part_numbers": [
      "PS5-4T-2280"
    ],
    "series": "Dash",
    "variant": "4000GB"
  },
  "capacity": 4000,
  "type": "SSD",
  "form_factor": "M.2-2280",
  "interface": "M.2 PCIe 4.0 X4",
  "nvme": true,
  "general_product_information": {
    "amazon_sku": "B09RYSXQDG",
    "walmart_sku": 985248867
  }
}