{
  "opendb_id": "db3deedc-8868-4314-87e2-98931a5d8818",
  "metadata": {
    "name": "Inland QN322 500GB SSD M.2-2280 PCIe 3.0 X4 NVME",
    "manufacturer": "Inland",
    "part_numbers": [
      "500GB QN322 NVM"
    ],
    "series": "QN322",
    "variant": "500GB"
  },
  "capacity": 500,
  "type": "SSD",
  "form_factor": "M.2-2280",
  "interface": "M.2 PCIe 3.0 X4",
  "nvme": true,
  "general_product_information": {
    "amazon_sku": "B0B96SP5RZ"
  }
}