{
  "opendb_id": "4a452e84-c30b-4b05-94c4-d2d65bd2bc9c",
  "metadata": {
    "name": "SK hynix Gold S31 500GB,Internal,2.5 inch (SHGS31500GS) Solid State Drive",
    "manufacturer": "SK hynix",
    "part_number": "SHGS31500GS",
    "series": "Gold S31",
    "variant": null,
    "releaseYear": 2019,
    "part_numbers": []
  },
  "capacity": 500,
  "type": "SSD",
  "form_factor": "2.5\"",
  "interface": "SATA III",
  "nvme": false,
  "general_product_information": {
    "amazon_sku": "B07SK5BNM1",
    "bestbuy_sku": 6431941,
    "walmart_sku": 364084167
  }
}