{
  "opendb_id": "3ad83203-83af-4924-8f2d-c988d7b2fa7b",
  "metadata": {
    "name": "Western Digital WD_BLACK SN850P for PS5 2TB SSD M.2-2280 PCIe 4.0 NVMe",
    "manufacturer": "Western Digital",
    "part_numbers": [
      "WDBBYV0020BNC-WRSN"
    ],
    "series": "WD_BLACK",
    "variant": "2000GB"
  },
  "capacity": 2000,
  "type": "SSD",
  "form_factor": "M.2-2280",
  "interface": "M.2 PCIe 4.0 X4",
  "nvme": true,
  "general_product_information": {
    "amazon_sku": "B0C47ZX1WB",
    "newegg_sku": "N82E16820250258",
    "bestbuy_sku": 6541326,
    "walmart_sku": 1967745437
  }
}