{
  "opendb_id": "98655c26-a166-4612-9b4e-70860819c04c",
  "metadata": {
    "name": "Crucial BX300 240GB SSD 2.5\" SATA 6.0 Gb/s",
    "manufacturer": "Crucial",
    "part_numbers": [
      "CT240BX300SSD1"
    ],
    "series": "BX300",
    "variant": "240GB"
  },
  "capacity": 240,
  "type": "SSD",
  "form_factor": "2.5\"",
  "interface": "SATA 6.0 Gb/s",
  "nvme": false,
  "general_product_information": {
    "amazon_sku": "B0742BC3DQ"
  }
}