{
  "opendb_id": "7a352299-eae0-410d-94f6-393cc48dcee6",
  "metadata": {
    "name": "TEAMGROUP T-Force GE PRO Graphene 1TB SSD M.2-2280 PCIe 5.0 X4 NVMe",
    "manufacturer": "TEAMGROUP",
    "part_numbers": [
      "TM8FFS001T0C129"
    ],
    "series": "T-Force",
    "variant": "1000GB"
  },
  "capacity": 1000,
  "type": "SSD",
  "form_factor": "M.2-2280",
  "interface": "M.2 PCIe 5.0 X4",
  "nvme": true,
  "general_product_information": {}
}