{
  "opendb_id": "1026404e-7a6b-468e-bb41-7804d64cb139",
  "metadata": {
    "name": "Patriot Burst 960GB SSD 2.5\" SATA 6.0 Gb/s",
    "manufacturer": "Patriot",
    "part_numbers": [
      "PBU960GS25SSDR"
    ],
    "series": "Burst",
    "variant": "960GB"
  },
  "capacity": 960,
  "type": "SSD",
  "form_factor": "2.5\"",
  "interface": "SATA 6.0 Gb/s",
  "nvme": false,
  "general_product_information": {}
}