{
  "opendb_id": "72761649-b085-411d-9604-949d1fedc98f",
  "metadata": {
    "name": "TEAMGROUP T-Force Delta Max RGB 250GB SSD 2.5\" SATA 6.0 Gb/s",
    "manufacturer": "TEAMGROUP",
    "part_numbers": [
      "T253TM250G3C302"
    ],
    "series": "T-Force",
    "variant": "250GB"
  },
  "capacity": 250,
  "type": "SSD",
  "form_factor": "2.5\"",
  "interface": "SATA 6.0 Gb/s",
  "nvme": false,
  "general_product_information": {}
}