{
  "opendb_id": "2111163d-e51e-4332-9db5-f204feaf4912",
  "metadata": {
    "name": "Intel D3-S4610 7.68 TB SSD 2.5\" SATA 6.0 Gb/s",
    "manufacturer": "Intel",
    "part_numbers": [
      "SSDSC2KG076T801"
    ],
    "series": "D3-S4610",
    "variant": "7000GB"
  },
  "capacity": 7000,
  "type": "SSD",
  "form_factor": "2.5\"",
  "interface": "SATA 6.0 Gb/s",
  "nvme": false,
  "general_product_information": {
    "amazon_sku": "B082J3N7B4",
    "newegg_sku": "9SIA12KJHZ2506",
    "walmart_sku": 277985938
  }
}