{
  "opendb_id": "dce8f985-5bde-428c-9638-306967ab457e",
  "metadata": {
    "name": "ADATA LEGEND 700 GOLD 2TB SSD M.2-2280 PCIe 3.0 X4 NVMe",
    "manufacturer": "ADATA",
    "part_numbers": [
      "SLEG-700G-2TCS-S48"
    ],
    "series": "LEGEND",
    "variant": "2000GB"
  },
  "capacity": 2000,
  "type": "SSD",
  "form_factor": "M.2-2280",
  "interface": "M.2 PCIe 3.0 X4",
  "nvme": true,
  "general_product_information": {
    "amazon_sku": "B0CD65JQYC",
    "walmart_sku": 3949399692
  }
}