{
  "opendb_id": "70642c0b-7bf7-463b-a928-29de85105e9a",
  "metadata": {
    "name": "Kingston KC600 256GB SSD 2.5\" SATA 6.0 Gb/s",
    "manufacturer": "Kingston",
    "part_numbers": [
      "SKC600MS256G"
    ],
    "series": "KC600",
    "variant": "256GB"
  },
  "capacity": 256,
  "type": "SSD",
  "form_factor": "2.5\"",
  "interface": "SATA 6.0 Gb/s",
  "nvme": false,
  "general_product_information": {
    "amazon_sku": "B08ZNSNL1K",
    "newegg_sku": "0D9-001B-004P2",
    "walmart_sku": 888902658
  }
}